Question;Answer
When was the Babylonian Empire?;1900 B.C. to 1600 B.C.
Were farmers successful in Babylon?;Yes
What did Babylonians build with?;Bricks
What did King Hammurabi create?;Hammurabi’s Code
If a son hit his father, what would his punishment be under Hammurabi’s Code?;His hands would be chopped off.
What were some reasons Hammurabi’s Code was important?;a. It was written b. It was publicly displayed Because of these two facts, everyone had to follow the Code, and the leaders couldn’t change the law whenever they wanted to.
