1. Crop rotation?;Farmers rotated crops they grew on land in order to keep the land fertile.
2. What were letters of credit?;Merchants travelled with a piece of paper that explained what the paper was worth.
3. What was a guild?;Medieval tradesmen formed associations to perfect their work and to make more money.
4. What was a longbow?;The longbow was a powerful weapon that could propel an arrow so fast and strong it would pierce armor.
5. What was the Hundred Years’ War?;From 1337 to 1453, France fought England.
6. What was the Bubonic Plague?;This epidemic, also called Black Death, killed more than 1/3 of Europeans between 1347 and 1400.
