1. What is the successor of Muhammad called?;Caliph
2. Who is a Shiite?;He is a Muslim who thinks the Caliph should be a blood relative of Muhammad.
3. Who is a Sunni?;He is a Muslim who thinks the Caliph doesn’t have to be a blood relative of Muhammad.
4. What did Muslim armies do from about 600 – 1100?;They conquered many territories and converted many people to Islam.
5. What is jihad?;It is a Holy War for Muslims.
6. Who invaded Spain and tried to conquer Europe?;Muslims
7. Who conquered the Christian Holy Land from the Romans?;Muslims
