Question,Answer
"What is a French phrase which means a policy of hands off, limited government and minimal taxes? It was the economic policy of the United States government in the 1800s and it brought great economic growth.",Laissez-faire
Who was the last Founding Father as President and a traditionalist? He was the last President to wear his hair in a ponytail. He followed a policy of limited government.,James Monroe
What is a person who thinks the government only has power to do what is explicitly written in the Constitution? Monroe was one.,Strict constructionist
"In 1820, James Monroe issued which policy that forbade European countries the right to meddle in the affairs of Northern or Southern America?",The Monroe Doctrine (1820)
"In 1819, the U.S. bought Florida from Spain for $5 million in which treaty?",Adams-Onis Treaty
