Question,Answer
"What was the name of the first battle of the war, taking place on July 16, 1861, with a Southern victory?",The Battle of Bull Run.
Where was the capital of the C.S.A?,"Richmond, Virginia."
Where was the capital of the U.S.A?,"Washington, D.C."
Who was a Confederate commander in the Civil War that had the nickname 'Stonewall'?,Thomas Jackson.
"What did the North do to the South during the war, not allowing Southern ships to leave or enter the C.S.A?",Blockade.
What were two iron-plated ships that faced each other in battle?,Monitor v. Merrimack.
